{
  "index": 1,
  "captured_at": "2026-06-24T10:05:27Z",
  "method": "POST",
  "path": "/v1/chat/completions",
  "headers": {
    "accept": "text/event-stream",
    "accept-encoding": "gzip, br, deflate",
    "authorization": "<redacted>",
    "content-length": "1112",
    "content-type": "application/json",
    "host": "host.docker.internal:41063",
    "user-agent": "grok-shell/0.2.63 (linux; x86_64)",
    "x-grok-agent-id": "",
    "x-grok-client-identifier": "grok-shell",
    "x-grok-client-version": "0.2.63",
    "x-grok-conv-id": "",
    "x-grok-model-override": "grok-build",
    "x-grok-req-id": "",
    "x-grok-session-id": ""
  },
  "body_text": "{\"model\":\"grok-build\",\"messages\":[{\"role\":\"system\",\"content\":\"You are tasked with generating the session title. The user is asking almost always software engineering related questions on their codebase.\\nWe describe the session title below\\n# Session Title\\nA short and distinctive 5-10 word descriptive title for the session. Super info dense, no filler.\\n\\nYou will be given the user query below encapsulated in <user_query></user_query>.\\n\\nJust generate the session_title and nothing else\"},{\"role\":\"user\",\"content\":\"<user_query>\\nHi\\n</user_query>\"}],\"temperature\":1.0,\"max_tokens\":100,\"tools\":[{\"type\":\"function\",\"function\":{\"name\":\"session_title\",\"description\":\"Generate the session_title which we use for the user_message\",\"parameters\":{\"type\":\"object\",\"required\":[\"session_title\"],\"properties\":{\"session_title\":{\"type\":\"string\",\"description\":\"Final session title, just 5-10 word descriptive title for the session. Super info dense, no filler.\"}},\"additionalProperties\":false}}}],\"tool_choice\":{\"type\":\"function\",\"function\":{\"name\":\"session_title\"}},\"stream\":true,\"stream_options\":{\"include_usage\":true}}",
  "json": {
    "model": "grok-build",
    "messages": [
      {
        "role": "system",
        "content": "You are tasked with generating the session title. The user is asking almost always software engineering related questions on their codebase.\nWe describe the session title below\n# Session Title\nA short and distinctive 5-10 word descriptive title for the session. Super info dense, no filler.\n\nYou will be given the user query below encapsulated in <user_query></user_query>.\n\nJust generate the session_title and nothing else"
      },
      {
        "role": "user",
        "content": "<user_query>\nHi\n</user_query>"
      }
    ],
    "temperature": 1.0,
    "max_tokens": 100,
    "tools": [
      {
        "type": "function",
        "function": {
          "name": "session_title",
          "description": "Generate the session_title which we use for the user_message",
          "parameters": {
            "type": "object",
            "required": [
              "session_title"
            ],
            "properties": {
              "session_title": {
                "type": "string",
                "description": "Final session title, just 5-10 word descriptive title for the session. Super info dense, no filler."
              }
            },
            "additionalProperties": false
          }
        }
      }
    ],
    "tool_choice": {
      "type": "function",
      "function": {
        "name": "session_title"
      }
    },
    "stream": true,
    "stream_options": {
      "include_usage": true
    }
  }
}
