{
  "index": 1,
  "captured_at": "2026-06-13T16:34:09Z",
  "method": "HEAD",
  "path": "/",
  "headers": {
    "Accept": "*/*",
    "Accept-Encoding": "gzip, deflate, br, zstd",
    "Connection": "keep-alive",
    "Host": "host.docker.internal:39513",
    "User-Agent": "Bun/1.3.13"
  },
  "body_text": "",
  "json": null
}
